#CODE;RUSSIAN;;;;;;;;;;;;;x
EVTTITLE_WCCLS_1;Обучение начато;;;;;;;;;;;;;x
EVTDESC_WCCLS_1;Путь Мага - это путь удивительной и шокирующей силы. Умелый маг в одиночку способен противостоять армиям, атакуя сгустками тайной магии или насылая на врагов огненные дожди и снежные бури. Если же кто-то и доберется до заклинателя, то просто не сможет нанести удар - маг окружит себя многочисленными щитами, в которых будут увязать мечи и отскакивать вражеские заклинания. Вы сможете достичь ещё больших высот, чем сейчас, если продолжите развивать свой магический дар.;;;;;;;;;;;;;x
EVTTITLE_WCCLS_100;Обучение закончено;;;;;;;;;;;;;x
EVTDESC_WCCLS_100;Вы закончили обучение пути Мага и покорили многие школы магии. Любой противник трижды подумает, прежде чем напасть на вас, одинокого странника, вооруженного лишь посохом. Однако, будьте осторожны с магией, она способна уничтожать целые города, оставляя после себя лишь пустоту. Удачи, маг! И последнее наставление-мудрость - не бейте по комарам огненными шарами, Вы выше этого - замораживайте их.;;;;;;;;;;;;;x
EVTDESC_WCCLS_101;Путь Охотника - это путь одиночек, которые гораздо лучше ладят с животным миром, чем с окружающими. Никто не знает округу и леса лучше, чем охотники. Никто не знает столько, сколько охотники знают о животных. А приручив их, они получат надёжного друга, неспособного на предательство. Непревзойденные мастера ловушек, выслеживания и стрельбы из всего, что стреляет, всегда рады наставить и дать совет.;;;;;;;;;;;;;x
EVTDESC_WCCLS_200;Вы закончили обучение пути Охотника и обзавелись новыми друзьями - зверьми, которые будут следовать за Вами неотступно. А изучив премудрости слежки и охоты, вы способны преследовать противника сколько угодно, выматывая его и лишая сил. И если враг осмелится повернуться лицом, то его ждет встреча со всей вашей стаей, которую он вряд ли переживет... Удачи, Охотник! Звери не лгут, и любой из них может стать другом во враждебном мире.;;;;;;;;;;;;;x
EVTDESC_WCCLS_201;Путь Воина - это путь героев сражений многих рас. Именно воины ведут армии и вдохновляют на победу. Именно воины своей храбростью и умением обеспечивают перелом в битвах. Продолжив обучение, вы сможете достичь непревзойденного мастерства и узнать секреты, позволяющие выйти победителем из любых сражений.;;;;;;;;;;;;;x
EVTDESC_WCCLS_300;Вы закончили обучение пути Воина и теперь готовы встретить любого неприятеля в первых рядах. Неважно, будете ли вы сражаться мечом и щитом, двуручным мечом или мечами в обеих руках - даже табуретка в ваших руках станет смертоносным оружием. Удачи, Воин! Надеемся, вы не посрамите честь и достоинство своих учителей.;;;;;;;;;;;;;x
EVTDESC_WCCLS_301;Путь Паладина - это благородное и благословленное самим Светом ремесло. Именно паладины стоят на страже зла со времен Второй Войны, и способны выступать без страха против таких противников, которых невозможно поразить простым оружием. Вы впустили в себя Святой Свет и теперь способны укреплять свой молот святостью, а продолжив постигать секреты мастерства, сможете изгнать любое зло из темнейших уголков этого мира.;;;;;;;;;;;;;x
EVTDESC_WCCLS_400;Вы закончили обучение пути Паладина, и сам Свет отметил вас своей печатью, даровав целительные силы. Одним своим видом вы способны обратить в бегство силы зла, но если они осмелятся напасть на святого воина, то будут уничтожены и сожжены Светом. Удачи, Паладин! Вы - защита и опора мира, сметайте и изгоняйте любое зло, угрожающее ему.;;;;;;;;;;;;;x
EVTDESC_WCCLS_401;Путь Жреца - это путь служителей веры. Как и Паладины, они являются проводниками Света, и, хоть не стоят на передовой, они все равно способны защитить себя и окружающих в случае угрозы. Вы знаете, что ваши защитные чары и заклинания усиливаются крепостью духа. Служение Свету и народу Азерота сможет значительно усилить вашу силу.;;;;;;;;;;;;;x
EVTDESC_WCCLS_500;Вы закончили обучение пути Жреца и изучили школы как исцеления, так и тьмы. Как именно применять дар Света - решать вам. Издавна, со времен появления магии Света, жрецы поддерживали свой народ, давая искру надежды даже в самые темные времена. Удачи, Жрец! И не извращайте святой Свет понапрасну - он может и покинуть служителя, окунув его в пучину тьмы и отчаяния.;;;;;;;;;;;;;x
EVTDESC_WCCLS_501;Путь Разбойника - это путь коварства и обмана. Многие проклинают тех, кто на него ступил. Профессиональные убийцы и наемники, не соблюдающие никаких правил и кодексов, кроме заключенного договора с нанимателем. Постигая ремесло, вы отточите навыки проникновения куда угодно и совершения незаметных убийств.;;;;;;;;;;;;;x
EVTDESC_WCCLS_600;Вы закончили обучение пути Разбойника, и теперь сами тени будут вам союзниками, пряча от взглядов. Изучив множество хитроумных трюков и коварных уловок, вы способны сразить кого угодно, нападая исподтишка, и исчезая в тот момент, когда противник готов нанести ответный удар. Удачи, Разбойник! Мир, где честь и достоинство ничего не значат, принадлежит нам!;;;;;;;;;;;;;x
EVTDESC_WCCLS_601;Путь Чернокнижника - это путь магии Скверны, принесенный захватчиками из другого мира. В нашем мире многие тоже прельстились величайшими возможностями этой силы. Вы обращаетесь к темным искусствам, дабы нести хаос, смятение и разрушение в ряды противника. Обладая сильной волей, вы способны призывать на службу различных кровожадных демонов и удерживать их в подчинении. Продолжая изучение, вы обуздаете еще более разрушительные заклятия и сможете призывать могущественных демонов.;;;;;;;;;;;;;x
EVTDESC_WCCLS_700;Вы закончили обучение пути Чернокнижника. Вашей воле подчинились демоны, и признали в вас своего хозяина. Многие в мире боятся колдунов, и не зря. Магия чернокнижника способна разрушать душу своей жертвы, откалывая и кристаллизуя ее частицы, которые позже используются в других ритуалах. А прислужники одним своим видом могут обратить в бегство врагов. Удачи, Чернокнижник! Несите страх и ужас перед Скверной всюду в этот мир!;;;;;;;;;;;;;x
EVTDESC_WCCLS_701;Путь Шамана - это путь духовного лидера, чья сила берется из природных стихий. В отличие от других заклинателей, вы просите силы стихий о помощи, и силы стихий, чаще всего, откликаются на зов. Шаманы пытаются уравновесить стихии воды, воздуха, земли и огня своим посредничеством, успокаивая одних и раззадоривая других. Продолжая изучать шаманизм, вы научитесь так договариваться со стихиями, что они с рвением и готовностью помогут и усилят вас.;;;;;;;;;;;;;x
EVTDESC_WCCLS_800;Вы закончили обучение пути Шамана и своими глазами увидели, что духи стихий повсюду. И вы теперь можете просить их о помощи в любой момент - для усиления собственного оружия, для придания магических сил вашим тотемам, для ослабления противника, но только в том случае, если стихии сочтут просьбу справедливой. Удачи, Шаман! А если в какой-то момент стихии не ответят, всегда можно воткнуть тотем врагу в голову. Как говорит известная шаманская поговорка - на стихии надейся, а сам не плошай.;;;;;;;;;;;;;x
EVTDESC_WCCLS_801;Путь Друида - это путь природной магии и защитников окружающего мира. Веками друиды хранили равновесие между животными, растениями и климатом. Тем не менее, все души разные, поэтому и друиды могут быть агрессивными в своих намерениях. Вы уже знаете, что хрупкий баланс можно поддержать не только исцелением, но и разрушением. Продолжив изучение друидизма, Вы еще больше познаете, что Природа не столь безобидна.;;;;;;;;;;;;;x
EVTDESC_WCCLS_900;Вы закончили обучение пути Друида и научились как исцелять магией, так и уничтожать ею же. Любой противник познает на себе всю безграничную мощь природы, а заклинания исцеления будут лечить раны этого мира. Удачи, Друид! Храните, поддерживайте и защищайте природу во имя Кенария!;;;;;;;;;;;;;x
EVTDESC_WCCLS_901;Путь Жреца Лоа - это путь служителя мистической религии вуду, практикуемой троллями и некоторыми другими племенными расами. Вуду для чужаков кажется мрачным сочетанием шаманизма, темной магии и алхимии, но, тем не менее, оно весьма эффективно. Будучи жрецом, вы духовно и магически связываетесь с одним из духов пантеона вуду - Лоа, который наделяет Вас колоссальной силой за почитание и жертвоприношения. И чем большей силой вы хотите обладать, тем больше убийств во имя Лоа нужно совершить.;;;;;;;;;;;;;x
EVTDESC_WCCLS_1000;Вы закончили обучение пути Жреца Лоа, и способны показать миру всю силу и мощь вашего Лоа-покровителя. Будучи духом природы, Лоа в любой момент способен придти к вам на зов в виде магической силы или в облике могучего зверя. Разумеется, если вы принесли ему достаточно жертв. Удачи, Жрец Лоа! Пора показать, что с Вуду стоит считаться всем.;;;;;;;;;;;;;x
EVTDESC_WCCLS_1101;Путь Некроманта - это путь темной магии, способной оживлять трупы животных и разумных существ. При этом оживленный не обладает волей и подчиняется поднявшему его заклинателю. Изучая эту магию и дальше, вы, со временем, сможете возвращать к жизни все больше и больше существ, окружая себя армией, которая станет вашим превосходным щитом и мечом против любого противника.;;;;;;;;;;;;;x
EVTDESC_WCCLS_1200;Вы закончили обучение пути Некроманта, и способны показать врагам все свое могущество. А потом поднять этих самых врагов в качестве солдат для своей охраны или армии. Таким образом, никто и не захочет быть вашим врагом и такой участи после смерти. Удачи, Некромант! Чем больше у вас будет противников, тем сильнее вы станете, когда с ними разберетесь.;;;;;;;;;;;;;x
EVTDESC_WCFTW_1;Ваша Орда уже прошла через портал. Вы заключили сделку и вам нужно выполнить свою часть. Королевство Штормград должно пасть.;;;;;;;;;;;;;x
EVTOPTA_WCFTW_1;Мы будет завоевателями!;;;;;;;;;;;;;x
EVTOPTB_WCFTW_1;Нападем на кого-то другого.;;;;;;;;;;;;;x
EVTTITLE_WCFTW_100;Вторжение из Дренора;;;;;;;;;;;;;x
EVTDESC_WCFTW_100;Надвигается буря... На юге Азерота, в Черных топях, был открыт Темный портал - врата в Дренор. Дикий мир, дом для орков, огров и многих других существ. Движимые жаждой крови и желанием найти новый дом, на замену их умирающему миру, многие орки, возглавляемые вождями кланов и единым главой Орды, стремятся пройти через Темный портал и покорить новый мир.;;;;;;;;;;;;;x
LOKTAR_OGAR;Лок'тар огар!;;;;;;;;;;;;;x
EVTOPTB_WCFTW_100;Надо что-то с этим делать!;;;;;;;;;;;;;x
EVTOPTC_WCFTW_100;Посмотрим, что из этого выйдет.;;;;;;;;;;;;;x
#LINE_REMOVED_DONT_TOUCH;Великая война между Ордой орков и Королевством Штромград разгорается все сильнее, и королевство людей несет крупные потери против орочьих захватчиков. Их посланники при нашем дворе просят помощи. Как мы ответим?;;;;;;;;;;;;;x
#LINE_REMOVED_DONT_TOUCH;Мы не собираемся посылать наши войска в чью-либо войну.;;;;;;;;;;;;;x
#LINE_REMOVED_DONT_TOUCH;Это не наша забота.;;;;;;;;;;;;;x
#LINE_REMOVED_DONT_TOUCH;Сегодня прибыли военные отряды дворфов Стальгорна. Возможно, еще не все потеряно...;;;;;;;;;;;;;x
#LINE_REMOVED_DONT_TOUCH;Отлично!;;;;;;;;;;;;;x
EVTOPTA_case1_WCFTW_4;Теперь никто не сможет остановить Орду!;;;;;;;;;;;;;x
EVTOPTA_case2_WCFTW_4;Еще не все потеряно.;;;;;;;;;;;;;x
EVTOPTA_case3_WCFTW_4;Мы должны готовиться к худшему.;;;;;;;;;;;;;x
EVTOPTA_case4_WCFTW_4;Сокрушить моих врагов!;;;;;;;;;;;;;x
EVTOPTA_case5_WCFTW_4;Что мне делать дальше?;;;;;;;;;;;;;x
EVTTITLE_WCFTW_4;Вторжение из Дренора;;;;;;;;;;;;;x
EVTDESC_WCDAC_4014;Одно кресло в совете [target_loyal_ruler.GetTitledFirstName] пустует. Лучшим выбором будет отдать этот пост одному из лидеров Совета Теней, чтобы не потерять контроль.;;;;;;;;;;;;;x
EVTOPTB_WCDAC_4014;Я назначу доверенную личность из моего двора.;;;;;;;;;;;;;x
EVTOPTC_WCDAC_4014;Мы должны назначить одного из наших новых аколитов.;;;;;;;;;;;;;x
EVTOPTA_WCDAC_4014;Я знаю подходящую персону для этой работы.;;;;;;;;;;;;;x
has_class_trait_trigger_tooltip;Принадлежит к одному из классов\n;;;;;;;;;;;;;x
is_mage_class_trigger_tooltip;Маг;;;;;;;;;;;;;x
is_hunter_class_trigger_tooltip;Охотник;;;;;;;;;;;;;x
is_warrior_class_trigger_tooltip;Воин;;;;;;;;;;;;;x
is_paladin_class_trigger_tooltip;Паладин;;;;;;;;;;;;;x
is_priest_class_trigger_tooltip;Жрец;;;;;;;;;;;;;x
is_rogue_class_trigger_tooltip;Разбойник;;;;;;;;;;;;;x
is_warlock_class_trigger_tooltip;Чернокнижник;;;;;;;;;;;;;x
is_shaman_class_trigger_tooltip;Шаман;;;;;;;;;;;;;x
is_druid_class_trigger_tooltip;Друид;;;;;;;;;;;;;x
is_loa_priest_class_trigger_tooltip;Жрец Лоа;;;;;;;;;;;;;x
is_death_knight_class_trigger_tooltip;Рыцарь Смерти;;;;;;;;;;;;;x
is_necromancer_class_trigger_tooltip;Некромант;;;;;;;;;;;;;x
is_shadow_priest_class_trigger_tooltip;Жрец Тьмы;;;;;;;;;;;;;x
EVTDESC_WCSDW_100;К вам пришло таинственное послание от неизвестного отправителя. Безымянный автор говорит о могущественном артефакте, способном подчинить волю даже самых могущественных существ. Артефакт хорошо спрятан где-то в Азероте, но неизвестный отправил вместе с письмом карту к ''сокровищу'' и найти его не составит особого труда.;;;;;;;;;;;;;x
EVTOPTA_WCSDW_100;Звучит заманчиво... С его помощью я смогу разбить всех моих врагов!;;;;;;;;;;;;;x
EVTOPTA_WCSDW_100_tooltip;Вы начинаете поиск §Yартефакта§!;;;;;;;;;;;;;x
EVTOPTB_WCSDW_100;Все это очень подозрительно... Я, пожалуй, откажусь.;;;;;;;;;;;;;x
EVTOPTB_WCSDW_100_tooltip;§YАртефакт§! останется скрыт от глаз посторонних.;;;;;;;;;;;;;x
EVTDESC_WCSDW_101;После непродолжительных поисков вы находите некий предмет. На вид это простой золотой талисман, но он излучает огромную силу. Талисман мерцает и, кажется, шепчет вам...;;;;;;;;;;;;;x
EVTOPTA_WCSDW_101;Неважно! Он позволит поработить моих врагов.;;;;;;;;;;;;;x
EVTTITLE_WCSDW_250;Разрушение Темного Портала;;;;;;;;;;;;;x
EVTDESC_WCSDW_250;Потерпев многочисленные поражения, Орда спешно отступила к Темному Порталу. К их несчастью, они лишь были загнаны в ловушку врагами, желавшими открыть для себя местоположение прохода в другой мир. Собравшись с силами, армии начали наступление на поредевшие войска Орды, оттесняя их все дальше и дальше к Порталу. Увидев ужасающие очертания Темного Портала на горизонте среди руин, защитники Азерота решили покончить с угрозой раз и на всегда. Темный Портал должен быть уничтожен. Арка Портала была разрушена с помощью магов, но невидимая связь двух миров сохранилась в виде шрама на ткани реальности.;;;;;;;;;;;;;x
EVTDESC_WCFTW_201;[From.GetFirstName] - предатель. Именно [From.GetSheHe] открыл портал между Дренором и Азеротом и обрек нас на погибель. Ему не заслуживает ни прощения, ни снисхождения.;;;;;;;;;;;;;x
EVTDESC_WCFTW_200;Вы собрали достаточно энергии, чтобы расширить портал в Дренор и переправить в Азерот всю Орду.;;;;;;;;;;;;;x
EVTOPTA_WCFTW_201;Он предал нас!;;;;;;;;;;;;;x
EVTOPTA_WCFTW_200;Время пришло.;;;;;;;;;;;;;x
EVTDESC_WCFTW_300;Скоро все поймут, что [target_medivh.GetFirstName] - предатель. Если его убьют, то секрет гробницы Саргераса умрет вместе с ним. Можно попробовать проникнуть в его разум и узнать путь к гробнице. Но есть шанс, что для вас все закончится плохо.;;;;;;;;;;;;;x
EVTOPTA_WCFTW_300;Мы уже слишком далеко зашли.;;;;;;;;;;;;;x
EVTOPTB_WCFTW_300;Я не собираюсь рисковать жизнью.;;;;;;;;;;;;;x
EVTOPTA_WCFTW_300_tooltip;Вы проникаете в разум §YХранителя§!.;;;;;;;;;;;;;x
EVTDESC_WCFTW_301;Вы добыли информацию о гробнице Саргераса. Она находится на Расколотых островах, где-то в Великом море. Путешествие в эти края будет опасным, но сила, что там таится, стоит того.;;;;;;;;;;;;;x
EVTOPTA_WCFTW_301;Приступим к ее поиску.;;;;;;;;;;;;;x
EVTOPTA_WCFTW_301_tooltip;§YВы§! можете начать поиск §Rгробницы Саргераса§!.;;;;;;;;;;;;;x
EVTDESC_WCFTW_302;Вы находились глубоко в чертогах разума, когда поняли, что [From.GetFirstName] издал свой последний вздох. Все вокруг вас начинает темнеть и вы осознаете, что теряете связь со своим материальным телом.;;;;;;;;;;;;;x
EVTOPTA_WCFTW_302;НЕЕЕТ!;;;;;;;;;;;;;x
EVTDESC_WCFTW_303;Силой воли вы смогли найти выход из тьмы.;;;;;;;;;;;;;x
